{
  "schema_version": 1,
  "generated_at": "2026-07-06T00:00:00Z",
  "reshade": {
    "min_version": "6.7.0",
    "nightly": {
      "url64": "https://nightly.link/crosire/reshade/workflows/build/main/ReShade%20(64-bit).zip",
      "url32": "https://nightly.link/crosire/reshade/workflows/build/main/ReShade%20(32-bit).zip"
    }
  },
  "defaults": { "min_app_version": "1.0.0", "channel": "stable" },
  "titles": [
    {
      "id": "alfred-hitchcock-vertigo",
      "name": "Alfred Hitchcock - Vertigo",
      "asset": "Luma-Unity_Engine.zip",
      "arch": "X64",
      "status": "working",
      "match": [
        { "kind": "steam_appid", "value": "1449320", "tier": 100 },
        { "kind": "exe_name", "value": "Vertigo.exe", "tier": 70 }
      ],
      "generic": true
    },
    {
      "id": "burnout-paradise-remastered",
      "name": "Burnout Paradise Remastered",
      "asset": "Luma-Burnout_Paradise_Remastered-x32.zip",
      "arch": "X86",
      "status": "working",
      "match": [{ "kind": "steam_appid", "value": "1238080", "tier": 100 }]
    },
    {
      "id": "cod-black-ops-3",
      "name": "Call of Duty: Black Ops III",
      "asset": "Luma-Call_of_Duty_Black_Ops_3.zip",
      "arch": "X64",
      "status": "working",
      "match": [
        { "kind": "steam_appid", "value": "311210", "tier": 100 },
        { "kind": "exe_name", "value": "blackops3.exe", "tier": 70 }
      ],
      "notes_keys": ["luma.note.bundled_dlss"]
    },
    {
      "id": "cocoon",
      "name": "Cocoon",
      "asset": "Luma-Unity_Engine.zip",
      "arch": "X64",
      "status": "working",
      "match": [
        { "kind": "steam_appid", "value": "1497440", "tier": 100 },
        { "kind": "exe_name", "value": "universe.exe", "tier": 70 }
      ],
      "generic": true
    },
    {
      "id": "deus-ex-human-revolution",
      "name": "Deus Ex: Human Revolution",
      "asset": "Luma-Deus_Ex_Human_Revolution_Director.s_Cut-x32.zip",
      "arch": "X86",
      "status": "working",
      "match": [
        { "kind": "steam_appid", "value": "238010", "tier": 100 },
        { "kind": "exe_name", "value": "DXHRDC.exe", "tier": 70 }
      ]
    },
    {
      "id": "dishonored-2",
      "name": "Dishonored 2",
      "asset": "Luma-Dishonored_2.zip",
      "arch": "X64",
      "status": "construction",
      "match": [
        { "kind": "steam_appid", "value": "403640", "tier": 100 },
        { "kind": "exe_name", "value": "Dishonored2.exe", "tier": 70 }
      ],
      "channel": "beta",
      "notes_keys": ["luma.note.bundled_dlss"]
    },
    {
      "id": "far-changing-tides",
      "name": "FAR: Changing Tides",
      "asset": "Luma-Unity_Engine.zip",
      "arch": "X64",
      "status": "working",
      "match": [
        { "kind": "steam_appid", "value": "1570010", "tier": 100 },
        { "kind": "exe_name", "value": "FarChangingTides.exe", "tier": 70 }
      ],
      "generic": true
    },
    {
      "id": "far-lone-sails",
      "name": "FAR: Lone Sails",
      "asset": "Luma-Unity_Engine.zip",
      "arch": "X64",
      "status": "working",
      "match": [
        { "kind": "steam_appid", "value": "609320", "tier": 100 },
        { "kind": "exe_name", "value": "FarLoneSails.exe", "tier": 70 }
      ],
      "generic": true
    },
    {
      "id": "final-fantasy-7-remake",
      "name": "Final Fantasy VII Remake",
      "asset": "Luma-Final_Fantasy_VII_Remake.zip",
      "arch": "X64",
      "status": "working",
      "match": [
        { "kind": "steam_appid", "value": "1462040", "tier": 100 },
        { "kind": "exe_name", "value": "ff7remake.exe", "tier": 70 }
      ],
      "notes_keys": ["luma.note.bundled_dlss"]
    },
    {
      "id": "granblue-fantasy-relink",
      "name": "Granblue Fantasy: Relink",
      "asset": "Luma-Granblue_Fantasy_Relink.zip",
      "arch": "X64",
      "status": "working",
      "match": [
        { "kind": "steam_appid", "value": "881020", "tier": 100 },
        { "kind": "exe_name", "value": "granblue_fantasy_relink.exe", "tier": 70 }
      ],
      "notes_keys": ["luma.note.bundled_dlss"]
    },
    {
      "id": "greedfall",
      "name": "GreedFall",
      "asset": "Luma-Greedfall.zip",
      "arch": "X64",
      "status": "working",
      "match": [
        { "kind": "steam_appid", "value": "606880", "tier": 100 },
        { "kind": "exe_name", "value": "GreedFall.exe", "tier": 70 }
      ],
      "notes_keys": ["luma.note.bundled_dlss"]
    },
    {
      "id": "hatsune-miku-project-diva-mega-mix-plus",
      "name": "Hatsune Miku: Project DIVA Mega Mix+",
      "asset": "Luma-Project_Diva_Mega_Mix.zip",
      "arch": "X64",
      "status": "working",
      "match": [
        { "kind": "steam_appid", "value": "1761390", "tier": 100 },
        { "kind": "exe_name", "value": "DivaMegaMix.exe", "tier": 70 }
      ]
    },
    {
      "id": "heavy-rain",
      "name": "Heavy Rain",
      "asset": "Luma-Heavy_Rain.zip",
      "arch": "X64",
      "status": "working",
      "match": [
        { "kind": "steam_appid", "value": "960910", "tier": 100 },
        { "kind": "exe_name", "value": "HeavyRain.exe", "tier": 70 }
      ]
    },
    {
      "id": "hollow-knight-silksong",
      "name": "Hollow Knight: Silksong",
      "asset": "Luma-Unity_Engine.zip",
      "arch": "X64",
      "status": "working",
      "match": [
        { "kind": "steam_appid", "value": "1030300", "tier": 100 },
        { "kind": "exe_name", "value": "Hollow Knight Silksong.exe", "tier": 70 }
      ],
      "generic": true
    },
    {
      "id": "inside",
      "name": "INSIDE",
      "asset": "Luma-INSIDE.zip",
      "arch": "X64",
      "status": "working",
      "match": [
        { "kind": "steam_appid", "value": "304430", "tier": 100 },
        { "kind": "exe_name", "value": "INSIDE.exe", "tier": 70 }
      ]
    },
    {
      "id": "just-cause-3",
      "name": "Just Cause 3",
      "asset": "Luma-Just_Cause_3.zip",
      "arch": "X64",
      "status": "working",
      "match": [
        { "kind": "steam_appid", "value": "225540", "tier": 100 },
        { "kind": "exe_name", "value": "JustCause3.exe", "tier": 70 }
      ],
      "notes_keys": ["luma.note.bundled_dlss"]
    },
    {
      "id": "lara-croft-temple-of-osiris",
      "name": "Lara Croft and the Temple of Osiris",
      "asset": "Luma-Lara_Croft_and_the_Temple_of_Osiris-x32.zip",
      "arch": "X86",
      "status": "working",
      "match": [
        { "kind": "steam_appid", "value": "289690", "tier": 100 },
        { "kind": "exe_name", "value": "LC2.exe", "tier": 70 }
      ]
    },
    {
      "id": "lego-city-undercover",
      "name": "LEGO City Undercover",
      "asset": "Luma-Lego_City_Undercover.zip",
      "arch": "X64",
      "status": "working",
      "match": [
        { "kind": "steam_appid", "value": "578330", "tier": 100 },
        { "kind": "exe_name", "value": "LEGOLCUR_DX11.exe", "tier": 70 }
      ]
    },
    {
      "id": "mafia-2-definitive-edition",
      "name": "Mafia II: Definitive Edition",
      "asset": "Luma-Mafia_II_Definitive_Edition.zip",
      "arch": "X64",
      "status": "working",
      "match": [
        { "kind": "steam_appid", "value": "1030830", "tier": 100 },
        { "kind": "exe_name", "value": "Mafia II Definitive Edition.exe", "tier": 70 }
      ]
    },
    {
      "id": "mafia-3",
      "name": "Mafia III",
      "asset": "Luma-Mafia_III.zip",
      "arch": "X64",
      "status": "working",
      "match": [
        { "kind": "steam_appid", "value": "360430", "tier": 100 },
        { "kind": "exe_name", "value": "mafia3definitiveedition.exe", "tier": 70 }
      ],
      "notes_keys": ["luma.note.bundled_dlss"]
    },
    {
      "id": "metro-2033-redux",
      "name": "Metro 2033 Redux",
      "asset": "Luma-Metro_Redux.zip",
      "arch": "X64",
      "status": "working",
      "match": [
        { "kind": "steam_appid", "value": "286690", "tier": 100 },
        { "kind": "exe_name", "value": "metro.exe", "tier": 70 }
      ],
      "notes_keys": ["luma.note.windowed_borderless_only"]
    },
    {
      "id": "nioh",
      "name": "Nioh",
      "asset": "Luma-Nioh.zip",
      "arch": "X64",
      "status": "working",
      "match": [
        { "kind": "steam_appid", "value": "485510", "tier": 100 },
        { "kind": "exe_name", "value": "nioh.exe", "tier": 70 }
      ]
    },
    {
      "id": "persona-5-royal",
      "name": "Persona 5 Royal",
      "asset": "Luma-Persona_5.zip",
      "arch": "X64",
      "status": "working",
      "match": [
        { "kind": "steam_appid", "value": "1687950", "tier": 100 },
        { "kind": "exe_name", "value": "P5R.exe", "tier": 70 }
      ],
      "notes_keys": ["luma.note.bundled_dlss"]
    },
    {
      "id": "prey-2017",
      "name": "Prey",
      "asset": "Luma-Prey.zip",
      "arch": "X64",
      "status": "working",
      "match": [
        { "kind": "steam_appid", "value": "480490", "tier": 100 },
        { "kind": "exe_name", "value": "Prey.exe", "tier": 70 }
      ],
      "notes_keys": ["luma.note.prey_extra_data", "luma.note.bundled_dlss"]
    },
    {
      "id": "thief-2014",
      "name": "Thief",
      "asset": "Luma-Thief_.2014.zip",
      "arch": "X64",
      "status": "working",
      "match": [
        { "kind": "steam_appid", "value": "239160", "tier": 100 },
        { "kind": "exe_name", "value": "shipping-thiefgame.exe", "tier": 70 }
      ]
    },
    {
      "id": "thumper",
      "name": "Thumper",
      "asset": "Luma-Thumper.zip",
      "arch": "X64",
      "status": "working",
      "match": [
        { "kind": "steam_appid", "value": "356400", "tier": 100 },
        { "kind": "exe_name", "value": "THUMPER_win8.exe", "tier": 70 },
        { "kind": "exe_name", "value": "THUMPER_dx9.exe", "tier": 70 }
      ]
    },
    {
      "id": "trine-5",
      "name": "Trine 5: A Clockwork Conspiracy",
      "asset": "Luma-Trine_5.zip",
      "arch": "X64",
      "status": "working",
      "match": [